{
  "id": "OneDayNoWeather",
  "destinationFixture": "Chicago",
  "days": 1,
  "tripTypes": [
    "cityBreak"
  ],
  "activities": [],
  "bagTypes": [],
  "style": "balanced",
  "homeCountryCode": "US",
  "homeCountrySource": "userConfirmed",
  "mustInclude": [
    "essentials.wallet",
    "essentials.phone"
  ],
  "mustNotInclude": [
    "clothing.winter_coat"
  ]
}
