{
  "id": "OverrideKeepsRainJacketDeleted",
  "destinationFixture": "Chicago",
  "weatherFixture": "ChicagoRainyFall",
  "days": 5,
  "tripTypes": [
    "cityBreak"
  ],
  "activities": [
    "sightseeing"
  ],
  "bagTypes": [
    "carryOn"
  ],
  "style": "balanced",
  "homeCountryCode": "US",
  "homeCountrySource": "userConfirmed",
  "overrides": [
    {
      "canonicalItemID": "clothing.rain_jacket",
      "action": "removed"
    }
  ],
  "mustInclude": [],
  "mustNotInclude": [
    "clothing.rain_jacket"
  ]
}
