{
  "id": "PreserveManualQuantity",
  "destinationFixture": "Chicago",
  "days": 6,
  "tripTypes": [
    "cityBreak"
  ],
  "activities": [
    "sightseeing"
  ],
  "bagTypes": [
    "carryOn"
  ],
  "style": "light",
  "chips": [
    "laundryAvailable"
  ],
  "homeCountryCode": "US",
  "homeCountrySource": "userConfirmed",
  "existing": [
    {
      "canonicalItemID": "clothing.tshirt",
      "displayName": "T-shirts",
      "category": "clothing",
      "quantity": 3,
      "isUserModified": true
    }
  ],
  "mustInclude": [
    "clothing.tshirt"
  ],
  "mustNotInclude": [],
  "expectedExactQuantities": {
    "clothing.tshirt": 3
  }
}
