{
  "id": "BusinessTrip3Day",
  "destinationFixture": "Chicago",
  "weatherFixture": "ChicagoRainyFall",
  "days": 3,
  "tripTypes": [
    "business"
  ],
  "activities": [
    "work"
  ],
  "bagTypes": [
    "carryOn"
  ],
  "style": "balanced",
  "homeCountryCode": "US",
  "homeCountrySource": "userConfirmed",
  "mustInclude": [
    "clothing.dress_shirt",
    "footwear.dress_shoes",
    "electronics.laptop",
    "electronics.laptop_charger"
  ],
  "mustNotInclude": [
    "clothing.swimsuit"
  ],
  "note": "Three days of client meetings in Chicago. Bringing my laptop, one team dinner on the Tuesday.",
  "mustInfer": [
    "work",
    "bringingLaptop"
  ],
  "mustNotInfer": [
    "hiking",
    "swimming",
    "laundryAvailable"
  ],
  "allowedSuggestions": [
    "electronics.hdmi",
    "electronics.mouse",
    "essentials.notebook",
    "essentials.pen",
    "clothing.blazer"
  ]
}
